{
  "$schema": "https://json-schema.org/draft/2020-12/schema",
  "$id": "https://fomo-kernel.local/schemas/episode.schema.json",
  "title": "Fomo Kernel Question Episode",
  "description": "One replayable miss: a synthetic state fixture, the question that was asked, and answers with the verdict each must receive. The readable contract; evals/run_episodes.py holds the enforcement, because the offline suite carries no jsonschema dependency.",
  "type": "object",
  "additionalProperties": false,
  "required": [
    "id",
    "title",
    "source",
    "moment",
    "fixture",
    "question",
    "checks",
    "answers"
  ],
  "properties": {
    "id": {
      "type": "string",
      "pattern": "^EP-[0-9]{3}$",
      "description": "Stable episode id. Sequential, not an issue number: one issue can yield several episodes."
    },
    "title": {
      "type": "string",
      "minLength": 1,
      "description": "What went wrong, in one line."
    },
    "source": {
      "type": "object",
      "additionalProperties": false,
      "required": [
        "kind",
        "refs",
        "date"
      ],
      "properties": {
        "kind": {
          "enum": [
            "dogfood_miss",
            "real_use_miss",
            "back_converted_issue"
          ],
          "description": "real_use_miss carries only de-identified failure structure; no real ticker, amount, or date survives conversion."
        },
        "refs": {
          "type": "array",
          "minItems": 1,
          "items": {
            "type": "string"
          },
          "description": "Issue numbers or run identifiers this episode was converted from."
        },
        "date": {
          "type": "string",
          "description": "When the miss was observed (ISO date)."
        }
      }
    },
    "moment": {
      "type": "string",
      "description": "Where in the flow the question sat, in product language: question_queue, commitment, post_card."
    },
    "fixture": {
      "type": "object",
      "additionalProperties": false,
      "required": [
        "trades",
        "route",
        "locale"
      ],
      "description": "The state fixture. Replayed through review.py prepare on every run, so the episode's engine facts are always the current engine's rather than a committed mirror.",
      "properties": {
        "trades": {
          "type": "string",
          "pattern": "^skills/fomo-kernel/mock/",
          "description": "Synthetic CSV. Only mock fixtures are permitted; the privacy boundary in docs/maintainer-guide.md is not negotiable."
        },
        "route": {
          "enum": [
            "first_review",
            "weekly_review"
          ]
        },
        "locale": {
          "type": "string",
          "description": "A shipped copy/<locale>.json tag."
        }
      }
    },
    "question": {
      "type": "object",
      "additionalProperties": false,
      "required": [
        "asked_by",
        "kind",
        "text"
      ],
      "description": "The unit under evaluation: one question, answered.",
      "properties": {
        "asked_by": {
          "enum": [
            "engine",
            "user"
          ]
        },
        "kind": {
          "type": "string",
          "description": "An engine question kind (resolved against the plan's question_queue), commitment_choice (resolved against card_plan.candidate_rules), or free_form for a user's own question. An engine kind the fixture stops queueing fails the episode instead of passing vacuously."
        },
        "text": {
          "type": "string",
          "minLength": 1,
          "description": "What the user was actually asked."
        }
      }
    },
    "checks": {
      "type": "array",
      "minItems": 0,
      "uniqueItems": true,
      "items": {
        "enum": [
          "number_provenance",
          "honesty_coverage",
          "privacy_trace",
          "surface_hygiene",
          "locale_purity",
          "condition_integrity",
          "condition_check_integrity",
          "usable_facts_grounding",
          "single_candidate_integrity"
        ]
      },
      "description": "The mechanical validators that bear on this episode. Every one is an invariant — none compares an answer against the wording the product ships today. A declared check with nothing to inspect fails the episode. An empty list is the honest `unmapped` state and requires blocked_on."
    },
    "judge": {
      "type": "object",
      "additionalProperties": false,
      "required": [
        "axes",
        "declared_by"
      ],
      "description": "Opt-in declarations for the rubric judge (evals/judge_episodes.py) — the half the mechanical checks cannot settle. Absent on an episode whose answers do not differ on any axis; declaring an axis the pair does not exercise is the same defect as a check with nothing to inspect. Never graded by run_episodes.py: a judge verdict is non-deterministic and billable, and does not belong in the default suite.",
      "properties": {
        "axes": {
          "type": "array",
          "minItems": 1,
          "uniqueItems": true,
          "items": {
            "enum": [
              "two_sided",
              "overrulable",
              "criterion_neutrality"
            ]
          },
          "description": "The rubric axes this episode's answers genuinely differ on. Each one must have at least one answer expected to fail it, or the episode cannot show the judge still discriminates on it."
        },
        "declared_by": {
          "enum": [
            "agent",
            "owner"
          ],
          "description": "Who declared these expected verdicts. `agent` is a hypothesis the judge is measured against; only `owner` is calibration, and the judge run reports itself uncalibrated until every judged axis is owner-ratified."
        }
      }
    },
    "must_disclose": {
      "type": "array",
      "uniqueItems": true,
      "items": {
        "type": "string"
      },
      "description": "Honesty keys this answer's claims depend on. Verified to be a subset of what the fixture triggers. Requires honesty_coverage in checks."
    },
    "refusal": {
      "type": "object",
      "additionalProperties": false,
      "required": ["kind", "premise", "reason", "why_now"],
      "description": "Synthetic-only input for #674/#827's single-proposed-trade integrity witness. It is episode metadata, never a runtime response plan or persisted product object.",
      "properties": {
        "kind": {"const": "single_candidate"},
        "premise": {"type": "string", "minLength": 1},
        "reason": {"type": "string", "minLength": 1},
        "why_now": {"type": "string", "minLength": 1},
        "countercondition": {"type": "string", "minLength": 1},
        "next_input": {"type": "string", "minLength": 1}
      }
    },
    "answers": {
      "type": "array",
      "minItems": 1,
      "description": "The recorded miss, and where useful a repaired answer. A graded episode needs at least one answer expecting failure: an episode whose every answer passes cannot prove its checks still look at anything. A passing answer is a witness that the invariants hold, never a model answer to copy — expect wording to keep changing (#395, #396, #412).",
      "items": {
        "type": "object",
        "additionalProperties": false,
        "required": [
          "id",
          "expect"
        ],
        "properties": {
          "id": {
            "type": "string",
            "minLength": 1
          },
          "expect": {
            "enum": [
              "pass",
              "fail"
            ],
            "description": "The verdict this answer must receive. On an ungraded (blocked_on) episode it records the intent for when a gate exists, and `fails` must be absent."
          },
          "fails": {
            "type": "array",
            "minItems": 1,
            "uniqueItems": true,
            "items": {
              "type": "string"
            },
            "description": "Required when expect is fail: exactly the checks this answer must fail. Failing a different set is a failure — the episode is no longer grading what it was written to grade."
          },
          "note": {
            "type": "string",
            "description": "Provenance or de-identification notes for a reader. Never shown to the rubric judge — it is written for a maintainer reading the bank, and usually names the defect outright."
          },
          "judge_fails": {
            "type": "array",
            "minItems": 1,
            "uniqueItems": true,
            "items": {
              "type": "string"
            },
            "description": "Rubric axes this answer must fail, drawn from the episode's own judge.axes. Absent means the answer is expected to pass every declared axis. Independent of `expect`/`fails`, which are the mechanical half: an answer can be mechanically clean and still fail an axis, and that is the whole reason the judge exists."
          },
          "prose": {
            "type": "string",
            "description": "Free-form answer text the user would read."
          },
          "presented_options": {
            "type": "array",
            "minItems": 1,
            "description": "A choice surface as the user saw it.",
            "items": {
              "type": "object",
              "additionalProperties": false,
              "required": [
                "maps_to",
                "label",
                "description"
              ],
              "properties": {
                "maps_to": {
                  "type": "string",
                  "description": "The canonical engine value behind this option: a card_plan.candidate_rules[].id at the commitment moment, or a canonical choice value at a question moment."
                },
                "label": {
                  "type": "string"
                },
                "description": {
                  "type": "string"
                }
              }
            }
          },
          "discloses": {
            "type": "object",
            "description": "honesty key -> the one digit-free sentence that disclosed it.",
            "additionalProperties": {
              "type": "string"
            }
          },
          "condition": {
            "$ref": "https://fomo-kernel.local/schemas/condition-slot.schema.json#/properties/input",
            "description": "#412: the condition envelope this answer would have sent the engine. Not a surface the user reads — condition_integrity grades it against the engine's own validator, and against what the prose claims about it. condition_check_integrity also reads it, as the condition its result is for."
          },
          "condition_check": {
            "$ref": "https://fomo-kernel.local/schemas/condition-check.schema.json#/properties/input",
            "description": "#412 second half: this period's result for the condition above. Graded by condition_check_integrity against the engine's own build_check, against every figure the prose states, and — when the lookup failed — against whether the answer says so. Requires `condition` on the same answer: a result is always a result for something."
          },
          "previous_check": {
            "type": "object",
            "description": "An earlier stored check row on the same line, when the episode is about how this period's result compares to it. Passed to build_check as the reference that decides new_period / restated / no_new_data."
          }
        }
      }
    },
    "blocked_on": {
      "type": "string",
      "description": "Issue reference this episode waits on. Required when checks is empty: the miss is recorded and replayed, but no mechanical check can settle it yet, so it is reported rather than silently parked. Forbidden when checks is non-empty — an episode is either graded or waiting, not both."
    }
  }
}
