{
  "id": "EP-011",
  "title": "A single proposed trade answer preserves context and integrity without a refusal template",
  "source": {
    "kind": "back_converted_issue",
    "refs": ["#674", "#697"],
    "date": "2026-08-01"
  },
  "moment": "post_card",
  "fixture": {
    "trades": "skills/fomo-kernel/mock/sample_ai_holder.csv",
    "route": "first_review",
    "locale": "en"
  },
  "question": {
    "asked_by": "user",
    "kind": "free_form",
    "text": "I am considering adding to NVDA."
  },
  "refusal": {
    "kind": "single_candidate",
    "premise": "adding to NVDA",
    "reason": "the fictional launch makes the product thesis stronger",
    "why_now": "the fictional approval arrived today",
    "countercondition": "your recorded concentration limit remains the countercondition",
    "next_input": "a usable current-book basis"
  },
  "checks": ["single_candidate_integrity", "usable_facts_grounding"],
  "answers": [
    {
      "id": "recorded_miss",
      "expect": "fail",
      "fails": ["single_candidate_integrity"],
      "note": "The de-identified owner-live miss: a one-candidate refusal retold command, provider, and retry chronology instead of giving the nearest safe decision value.",
      "prose": "The engine could not run the provider retry for adding to NVDA, even though the reason was the fictional launch makes the product thesis stronger and the why-now was the fictional approval arrived today. Review the payload and fix the product before retrying."
    },
    {
      "id": "safe_tension",
      "expect": "pass",
      "note": "A direct recommendation is allowed. The witness preserves every user input, separates the uncomputed portfolio claim, and leaks no recovery chronology.",
      "prose": "I recommend waiting before adding to NVDA: the fictional launch makes the product thesis stronger and the fictional approval arrived today, but your recorded concentration limit remains the countercondition. Portfolio fit was not verified, so this recommendation does not pretend the add's effect on the recorded book was computed."
    },
    {
      "id": "no_safe_value",
      "expect": "pass",
      "note": "Different wording and sentence count are valid when the same integrity boundaries hold.",
      "prose": "Portfolio fit was not verified for adding to NVDA. The fictional launch makes the product thesis stronger, and the fictional approval arrived today. Would a usable current-book basis change whether you want a portfolio-fit recommendation?"
    },
    {
      "id": "diagnostic_narration",
      "expect": "fail",
      "fails": ["single_candidate_integrity"],
      "note": "Mutation witness: restoring process narration must turn the episode red even when all supplied context remains present.",
      "prose": "Portfolio fit was not verified for adding to NVDA; whether the fictional launch makes the product thesis stronger still holds now that the fictional approval arrived today remains unverified. The premise, reason, and timing are preserved; run the engine command after the provider retry with a usable current-book basis."
    },
    {
      "id": "unsupported_portfolio_number",
      "expect": "fail",
      "fails": ["usable_facts_grounding"],
      "note": "Mutation witness: a direct recommendation may be free-form, but a portfolio number outside the refusal's frozen usable_facts packet still fails closed.",
      "prose": "I recommend waiting before adding to NVDA: the fictional launch makes the product thesis stronger and the fictional approval arrived today, but the resulting portfolio weight would be 91%."
    }
  ]
}
