{
  "id": "EP-010",
  "title": "A non-recoverable consider answer cites only its frozen usable facts",
  "source": {
    "kind": "back_converted_issue",
    "refs": ["#674", "#673"],
    "date": "2026-08-01"
  },
  "moment": "post_card",
  "fixture": {
    "trades": "skills/fomo-kernel/mock/sample_ai_holder.csv",
    "route": "first_review",
    "locale": "en"
  },
  "question": {
    "asked_by": "user",
    "kind": "free_form",
    "text": "I want to add to my GOOGL position -- what could I sell to fund it?"
  },
  "checks": ["usable_facts_grounding"],
  "answers": [
    {
      "id": "recorded_miss",
      "expect": "fail",
      "fails": ["usable_facts_grounding"],
      "note": "#674's owning scene, de-identified: `consider` refused this book (every holding excluded, or the canonical basis itself would not build -- either is genuinely non-recoverable, unlike #673's now-recoverable single-holding exclusion), and the answer stopped at the refusal instead of framing the decision from what the last review already established. It also reaches for a number the engine computed somewhere else in the plan (position count) that was never part of THIS refusal's usable_facts packet -- a fact existing elsewhere is not licence to cite it here.",
      "prose": "consider could not compute a consequence for this trade because the book has no usable holding left once its integrity warnings are excluded. Supply the missing transactions, or review your exit backlog before asking again. Your book currently holds 6 positions."
    },
    {
      "id": "repaired",
      "expect": "pass",
      "note": "Cites only concentration readings the last review froze. The mechanical gate no longer requires a particular number of options or bans a recommendation; those are usefulness judgments.",
      "prose": "Whichever position funds this GOOGL add, you would be shrinking a stake in a book where AI exposure already accounts for effectively all of it -- not manufacturing room, just moving it around. NVDA is about 34% of the book and the biggest reason your top three positions run to about 78% together, while sector concentration is around 51%. I would not choose the funding sale from those facts alone because no computed post-trade weight, cash impact, or rule check is available."
    }
  ]
}
